{
  "schemaVersion": 1,
  "platform": "steam",
  "verifiedAt": "2026-10-20",
  "region": "unspecified-public-store",
  "scope": "2026-10-20公开Steam本体页可见本体加16项附加内容的固定审计快照；不含合集、未公布或隐藏商品。",
  "baseProductId": "base",
  "products": [
    {
      "id": "base",
      "steamAppId": 813780,
      "zh": "决定版本体",
      "en": "Age of Empires II: Definitive Edition",
      "releaseDate": "2019-11-14",
      "acquisition": {
        "kind": "base-game",
        "sourceIds": ["steam"]
      },
      "prerequisites": {
        "productIds": [],
        "status": "verified",
        "sourceIds": ["steam"]
      },
      "contents": [
        {
          "mode": "aoe2",
          "kind": "civilizations",
          "summary": "原有的常规AoE2文明。",
          "names": [],
          "sourceIds": ["steam"]
        },
        {
          "mode": "aoe2",
          "kind": "campaigns",
          "summary": "原有战役与既有历史内容；具名战役入门另见战役目录。",
          "names": [],
          "sourceIds": ["steam"]
        }
      ],
      "sources": [
        {
          "id": "steam",
          "url": "https://store.steampowered.com/app/813780/",
          "title": "Age of Empires II: Definitive Edition",
          "verifiedAt": "2026-10-20",
          "status": "verified",
          "note": "已实际打开商品页；读取购买项、前置本体提示和内容说明。"
        }
      ],
      "includedProductIds": ["lords-of-the-west", "dawn-of-the-dukes", "dynasties-of-india"],
      "includedProductSourceIds": ["steam"]
    },
    {
      "id": "lords-of-the-west",
      "steamAppId": 1389240,
      "zh": "西方霸主",
      "en": "Lords of the West",
      "releaseDate": "2021-01-26",
      "acquisition": {
        "kind": "included-with-base",
        "sourceIds": ["steam", "base-package", "gift-announcement"]
      },
      "prerequisites": {
        "productIds": ["base"],
        "status": "verified",
        "sourceIds": ["steam"]
      },
      "contents": [
        {
          "mode": "aoe2",
          "kind": "civilizations",
          "summary": "2个常规AoE2文明",
          "names": [
            {
              "id": "aoe2:Burgundians",
              "en": "Burgundians",
              "zh": "勃艮第",
              "siteCivEn": "Burgundians"
            },
            {
              "id": "aoe2:Sicilians",
              "en": "Sicilians",
              "zh": "西西里",
              "siteCivEn": "Sicilians"
            }
          ],
          "sourceIds": ["steam"],
          "count": 2
        },
        {
          "mode": "aoe2",
          "kind": "campaigns",
          "summary": "3个具名战役",
          "names": [
            {
              "id": "aoe2:Edward Longshanks",
              "en": "Edward Longshanks",
              "zh": "长腿爱德华"
            },
            {
              "id": "aoe2:The Grand Dukes of the West",
              "en": "The Grand Dukes of the West",
              "zh": "西方大公爵"
            },
            {
              "id": "aoe2:The Hautevilles",
              "en": "The Hautevilles",
              "zh": "欧特维尔家族"
            }
          ],
          "sourceIds": ["steam"],
          "count": 3
        }
      ],
      "sources": [
        {
          "id": "steam",
          "url": "https://store.steampowered.com/app/1389240/",
          "title": "Lords of the West",
          "verifiedAt": "2026-10-20",
          "status": "verified",
          "note": "已实际打开商品页；读取购买项、前置本体提示和内容说明。"
        },
        {
          "id": "base-package",
          "url": "https://store.steampowered.com/app/813780/",
          "title": "Steam 本体当前购买项",
          "verifiedAt": "2026-10-20",
          "status": "verified",
          "note": "当前本体购买项列出四件物品：本体、西方霸主、公爵的崛起、印度王朝。"
        },
        {
          "id": "gift-announcement",
          "url": "https://www.ageofempires.com/news/celebrate-5-years-of-age-ii-de-with-a-fresh-deal-for-new-players/",
          "title": "官方五周年收录及赠送公告",
          "verifiedAt": "2026-10-20",
          "status": "verified",
          "note": "当前新购买本体含此包；公告同时说明当时已有Steam本体的玩家会获赠缺失的前三包。",
          "publishedAt": "2024-11-15"
        }
      ],
      "historicalReleaseIndex": 6
    },
    {
      "id": "dawn-of-the-dukes",
      "steamAppId": 1557210,
      "zh": "公爵的崛起",
      "en": "Dawn of the Dukes",
      "releaseDate": "2021-08-10",
      "acquisition": {
        "kind": "included-with-base",
        "sourceIds": ["steam", "base-package", "gift-announcement"]
      },
      "prerequisites": {
        "productIds": ["base"],
        "status": "verified",
        "sourceIds": ["steam"]
      },
      "contents": [
        {
          "mode": "aoe2",
          "kind": "civilizations",
          "summary": "2个常规AoE2文明",
          "names": [
            {
              "id": "aoe2:Bohemians",
              "en": "Bohemians",
              "zh": "波希米亚",
              "siteCivEn": "Bohemians"
            },
            {
              "id": "aoe2:Poles",
              "en": "Poles",
              "zh": "波兰",
              "siteCivEn": "Poles"
            }
          ],
          "sourceIds": ["steam"],
          "count": 2
        },
        {
          "mode": "aoe2",
          "kind": "campaigns",
          "summary": "3个具名战役",
          "names": [
            {
              "id": "aoe2:Algirdas and Kestutis",
              "en": "Algirdas and Kestutis",
              "zh": "阿基尔达斯和科斯图提斯"
            },
            {
              "id": "aoe2:Jadwiga",
              "en": "Jadwiga",
              "zh": "雅德维加"
            },
            {
              "id": "aoe2:Jan Zizka",
              "en": "Jan Zizka",
              "zh": "扬·杰式卡"
            }
          ],
          "sourceIds": ["steam"],
          "count": 3
        }
      ],
      "sources": [
        {
          "id": "steam",
          "url": "https://store.steampowered.com/app/1557210/",
          "title": "Dawn of the Dukes",
          "verifiedAt": "2026-10-20",
          "status": "verified",
          "note": "已实际打开商品页；读取购买项、前置本体提示和内容说明。"
        },
        {
          "id": "base-package",
          "url": "https://store.steampowered.com/app/813780/",
          "title": "Steam 本体当前购买项",
          "verifiedAt": "2026-10-20",
          "status": "verified",
          "note": "当前本体购买项列出四件物品：本体、西方霸主、公爵的崛起、印度王朝。"
        },
        {
          "id": "gift-announcement",
          "url": "https://www.ageofempires.com/news/celebrate-5-years-of-age-ii-de-with-a-fresh-deal-for-new-players/",
          "title": "官方五周年收录及赠送公告",
          "verifiedAt": "2026-10-20",
          "status": "verified",
          "note": "当前新购买本体含此包；公告同时说明当时已有Steam本体的玩家会获赠缺失的前三包。",
          "publishedAt": "2024-11-15"
        }
      ],
      "historicalReleaseIndex": 7
    },
    {
      "id": "dynasties-of-india",
      "steamAppId": 1869820,
      "zh": "印度王朝",
      "en": "Dynasties of India",
      "releaseDate": "2022-04-28",
      "acquisition": {
        "kind": "included-with-base",
        "sourceIds": ["steam", "base-package", "gift-announcement"]
      },
      "prerequisites": {
        "productIds": ["base"],
        "status": "verified",
        "sourceIds": ["steam"]
      },
      "contents": [
        {
          "mode": "aoe2",
          "kind": "civilizations",
          "summary": "3个常规AoE2文明",
          "names": [
            {
              "id": "aoe2:Bengalis",
              "en": "Bengalis",
              "zh": "孟加拉",
              "siteCivEn": "Bengalis"
            },
            {
              "id": "aoe2:Dravidians",
              "en": "Dravidians",
              "zh": "达罗毗荼",
              "siteCivEn": "Dravidians"
            },
            {
              "id": "aoe2:Gurjaras",
              "en": "Gurjaras",
              "zh": "瞿折罗",
              "siteCivEn": "Gurjaras"
            }
          ],
          "sourceIds": ["steam"],
          "count": 3
        },
        {
          "mode": "aoe2",
          "kind": "campaigns",
          "summary": "3个具名战役",
          "names": [
            {
              "id": "aoe2:Babur",
              "en": "Babur",
              "zh": "巴布尔"
            },
            {
              "id": "aoe2:Rajendra",
              "en": "Rajendra",
              "zh": "拉金德拉"
            },
            {
              "id": "aoe2:Devapala",
              "en": "Devapala",
              "zh": "提婆波罗"
            }
          ],
          "sourceIds": ["steam"],
          "count": 3
        }
      ],
      "sources": [
        {
          "id": "steam",
          "url": "https://store.steampowered.com/app/1869820/",
          "title": "Dynasties of India",
          "verifiedAt": "2026-10-20",
          "status": "verified",
          "note": "已实际打开商品页；读取购买项、前置本体提示和内容说明。"
        },
        {
          "id": "base-package",
          "url": "https://store.steampowered.com/app/813780/",
          "title": "Steam 本体当前购买项",
          "verifiedAt": "2026-10-20",
          "status": "verified",
          "note": "当前本体购买项列出四件物品：本体、西方霸主、公爵的崛起、印度王朝。"
        },
        {
          "id": "gift-announcement",
          "url": "https://www.ageofempires.com/news/celebrate-5-years-of-age-ii-de-with-a-fresh-deal-for-new-players/",
          "title": "官方五周年收录及赠送公告",
          "verifiedAt": "2026-10-20",
          "status": "verified",
          "note": "当前新购买本体含此包；公告同时说明当时已有Steam本体的玩家会获赠缺失的前三包。",
          "publishedAt": "2024-11-15"
        }
      ],
      "historicalReleaseIndex": 8
    },
    {
      "id": "return-of-rome",
      "steamAppId": 2141580,
      "zh": "罗马归来",
      "en": "Return of Rome",
      "releaseDate": "2023-05-16",
      "acquisition": {
        "kind": "paid-add-on",
        "sourceIds": ["steam", "base-package"]
      },
      "prerequisites": {
        "productIds": ["base"],
        "status": "verified",
        "sourceIds": ["steam"]
      },
      "contents": [
        {
          "mode": "aoe2",
          "kind": "civilizations",
          "summary": "常规AoE2的罗马文明",
          "names": [
            {
              "id": "aoe2:Romans",
              "en": "Romans",